{
  "run_id": "2026-09-01T09-00-00Z_dev",
  "pipeline_git_commit": "REPLACE_WITH_ACTUAL_COMMIT_SHA",
  "run_timestamp": "2026-09-01T09:00:00Z",
  "nextflow_version": "24.10.5",
  "profile": "dev",
  "samples": {
    "tumour": {
      "sample_name": "COLO829",
      "ena_run_accessions": ["TODO_FILL_AFTER_ENA_QUERY"]
    },
    "normal": {
      "sample_name": "COLO829BL",
      "ena_run_accessions": ["TODO_FILL_AFTER_ENA_QUERY"]
    }
  },
  "reference": {
    "build": "TODO_CONFIRM_GRCh38_VARIANT",
    "fasta_source": "TODO",
    "fasta_md5": "TODO"
  },
  "tool_versions": {
    "fastqc": "0.12.1",
    "multiqc": "1.21",
    "bwa_mem2": "2.2.1",
    "gatk": "4.5.0.0",
    "happy": "0.3.15-0",
    "vep": "111",
    "cnvkit": "0.9.10",
    "sigprofiler_matrix_generator": "1.3.6",
    "sigprofiler_assignment": "1.1.5"
  },
  "resources": {
    "panel_of_normals": {
      "source": "Broad public GCS bucket",
      "url": "gs://gatk-best-practices/somatic-hg38/1000g_pon.hg38.vcf.gz"
    },
    "gnomad_germline_resource": {
      "version": "TODO_CHECK_VCF_HEADER",
      "url": "gs://gatk-best-practices/somatic-hg38/af-only-gnomad.hg38.vcf.gz"
    },
    "small_exac_common": {
      "url": "gs://gatk-best-practices/somatic-hg38/small_exac_common_3.hg38.vcf.gz"
    },
    "cosmic_cgc": {
      "version": "v100 (or later — confirm at download time)",
      "download_date": "TODO"
    },
    "vep_cache": {
      "version": "111",
      "species": "homo_sapiens"
    },
    "sigprofiler_reference_set": {
      "version": "COSMIC SBS reference set v3.4"
    }
  },
  "truth_set": {
    "name": "NYGC COLO-829 (HiSeqX) somatic SNV/indel VCF",
    "citation": "Xiao, W. et al. Deep whole-genome sequencing of 3 cancer cell lines on 2 sequencing platforms. Sci Rep 2019. https://www.nature.com/articles/s41598-019-55636-3",
    "url": "https://raw.githubusercontent.com/nygenome/3-cancer-cell-lines-on-2-sequencers/master/data/Variants.HighCoverage.tar.gz (extract COLO-829 HiSeqX SNV/indel VCF; the paper's originally-cited nygenome.org URL is dead)",
    "genome_build": "GRCh38",
    "lineage_caveat": "NYGC's own pipeline, separate HiSeqX sequencing run/library prep from the PRJEB27698 FASTQs this pipeline aligns; not an independent multi-platform consensus (Craig et al. 2016 would be, but is EGA/dbGaP controlled-access only, declined for that reason). Treat concordance as agreement with another GATK-family somatic caller on a related-but-not-identical COLO829 preparation, not as absolute ground truth."
  },
  "containers": [
    { "module": "fastqc", "image": "quay.io/biocontainers/fastqc:0.12.1--hdfd78af_0", "digest": "TODO" },
    { "module": "multiqc", "image": "quay.io/biocontainers/multiqc:1.21--pyhdfd78af_0", "digest": "TODO" },
    { "module": "alignment", "image": "quay.io/biocontainers/bwa-mem2:2.2.1--he513fc3_0", "digest": "TODO" },
    { "module": "gatk", "image": "broadinstitute/gatk:4.5.0.0", "digest": "TODO" },
    { "module": "benchmark", "image": "quay.io/biocontainers/hap.py:0.3.15-0", "digest": "TODO" },
    { "module": "vep", "image": "ensemblorg/ensembl-vep:release_111", "digest": "TODO" },
    { "module": "cnvkit", "image": "quay.io/biocontainers/cnvkit:0.9.10--pyhdfd78af_0", "digest": "TODO" }
  ],
  "qc_thresholds": {
    "contamination_warn_threshold": 0.02,
    "contamination_fail_threshold": 0.05
  }
}
